{"schema_version":1,"id":"quiz-result-map","type":"predict_output","topic":"result","difficulty":"beginner","concepts":["result","map"],"question":"What does this program print?","code":"let value: Result<i32, &str> = Ok(3);\nlet doubled = value.map(|number| number * 2);\nprintln!(\"{doubled:?}\");","choices":[],"answer":{"kind":"output","value":"Ok(6)"},"explanation":"`Result::map` transforms the success value and preserves the error variant. Here it applies the closure to `3` and produces `Ok(6)`.","references":[{"title":"Option and Result handling","path":"../../02-standard-library/error_handling_basics/README.md"}]}
