{"schema_version":1,"id":"code-review-indexed-utf8","type":"code_review","topic":"string-operations","difficulty":"intermediate","concepts":["strings","utf8","collections"],"question":"Review this attempt to return the first character. Why is the indexing approach unsuitable, and what iterator-based replacement handles UTF-8 safely?","code":"fn first_letter(text: &str) -> char {\n    text[0]\n}","choices":[],"answer":{"kind":"review","value":"Rust strings cannot be indexed by integer because UTF-8 characters vary in byte length. Use `text.chars().next()` and return an `Option<char>` to represent empty input."},"explanation":"A byte offset is not generally a character boundary. Iterating over `chars` respects Unicode scalar boundaries, while `Option` handles the empty-string case honestly.","references":[{"title":"String operations","path":"../../../02-standard-library/string_operations/README.md"}]}
