{"schema_version":1,"id":"quiz-trait-default-method","type":"will_it_compile","topic":"traits","difficulty":"beginner","concepts":["traits","default-methods"],"question":"Will this compile?","code":"trait Greet {\n    fn message(&self) -> String {\n        String::from(\"hello\")\n    }\n}\n\nstruct Person;\nimpl Greet for Person {}\n\nfn main() {\n    println!(\"{}\", Person.message());\n}","choices":[],"answer":{"kind":"compiles","value":"true"},"explanation":"A trait can provide a default method body. `Person` implements the trait without overriding it, so it receives the default `message` method.","references":[{"title":"Traits and polymorphism","path":"../../06-intermediate-rust/traits_and_polymorphism/README.md"}]}
