{"schema_version":1,"id":"quiz-explicit-type-annotation","type":"multiple_choice","topic":"data-types","difficulty":"beginner","concepts":["type-annotations","inference"],"question":"Which declaration explicitly stores the value as an unsigned 8-bit integer?","choices":[{"id":"a","text":"let count: u8 = 12;"},{"id":"b","text":"let count = u8;"},{"id":"c","text":"let count: unsigned = 12;"}],"answer":{"kind":"choice","value":"a"},"explanation":"A colon after the binding name introduces a type annotation. `u8` is Rust’s unsigned eight-bit integer type.","references":[{"title":"Data types","path":"../../01-core-fundamentals/data_types/README.md"}]}
