{"schema_version":1,"id":"quiz-reassignment-keeps-type","type":"will_it_compile","topic":"variables-mutability","difficulty":"beginner","concepts":["mutability","types"],"question":"Will this compile?","code":"let mut label = \"start\";\nlabel = 1;","choices":[],"answer":{"kind":"compiles","value":"false"},"explanation":"`mut` permits reassignment, but it does not permit changing a binding’s type. `label` was inferred as `&str`, while `1` is an integer.","references":[{"title":"Variables and mutability","path":"../../01-core-fundamentals/variables_and_mutability/README.md"}]}
