{"schema_version":1,"id":"code-review-repeated-search","type":"code_review","topic":"collections","difficulty":"intermediate","concepts":["collections","performance","hashmap"],"question":"Review this lookup loop. What grows unnecessarily as the input grows, and which collection better fits repeated lookups by identifier?","code":"fn has_all_ids(ids: &[u32], wanted: &[u32]) -> bool {\n    wanted.iter().all(|id| ids.iter().any(|candidate| candidate == id))\n}","choices":[],"answer":{"kind":"review","value":"Each requested ID scans `ids`, producing repeated linear searches. Build a `HashSet<u32>` from `ids` when repeated membership checks justify the setup cost."},"explanation":"The current approach can be quadratic in the number of IDs and requests. A set makes the intended membership operation explicit and usually gives faster repeated lookups.","references":[{"title":"Collections","path":"../../../02-standard-library/collections/README.md"}]}
