{"schema_version":1,"id":"quiz-generic-identity","type":"will_it_compile","topic":"generics","difficulty":"beginner","concepts":["generics","functions"],"question":"Will this compile?","code":"fn identity<T>(value: T) -> T {\n    value\n}\n\nfn main() {\n    println!(\"{}\", identity(4));\n}","choices":[],"answer":{"kind":"compiles","value":"true"},"explanation":"The generic type parameter `T` lets the function accept and return the same concrete type. Here Rust infers `T` as `i32`.","references":[{"title":"Generics","path":"../../06-intermediate-rust/generics/README.md"}]}
