{"schema_version":1,"id":"quiz-clippy-purpose","type":"multiple_choice","topic":"tooling","difficulty":"beginner","concepts":["clippy","linting"],"question":"What is Cargo Clippy primarily for?","choices":[{"id":"a","text":"Finding likely mistakes and non-idiomatic Rust through lints"},{"id":"b","text":"Resolving every dependency version automatically"},{"id":"c","text":"Publishing a crate"}],"answer":{"kind":"choice","value":"a"},"explanation":"Clippy is Rust’s lint collection for patterns that may be wrong, inefficient, or less idiomatic. It complements compilation and tests.","references":[{"title":"Code quality tools","path":"../../03-tooling-and-quality/code_quality_tools/README.md"}]}
