{"schema_version":1,"id":"quiz-match-boolean","type":"predict_output","topic":"control-flow","difficulty":"beginner","concepts":["match","booleans"],"question":"What does this program print?","code":"let ready = true;\nlet message = match ready {\n    true => \"go\",\n    false => \"wait\",\n};\nprintln!(\"{message}\");","choices":[],"answer":{"kind":"output","value":"go"},"explanation":"The `true` arm matches and produces the string assigned to `message`.","references":[{"title":"Control flow","path":"../../01-core-fundamentals/control_flow/README.md"}]}
