{"schema_version":1,"id":"quiz-rustfmt-command","type":"design_choice","topic":"tooling","difficulty":"beginner","concepts":["cargo","formatting"],"question":"Before opening a pull request that changes Rust source, which command is the usual project-wide formatting step?","choices":[{"id":"a","text":"cargo fmt"},{"id":"b","text":"cargo fix --broken-code"},{"id":"c","text":"cargo clean"}],"answer":{"kind":"choice","value":"a"},"explanation":"`cargo fmt` applies Rustfmt’s standard formatting. It is a predictable, low-risk preparation step before review.","references":[{"title":"Code quality tools","path":"../../03-tooling-and-quality/code_quality_tools/README.md"}]}
