{"schema_version":1,"id":"quiz-option-exhaustive-match","type":"fix_error","topic":"result","difficulty":"beginner","concepts":["option","match","exhaustiveness"],"question":"What case must be added for this match to compile?","code":"let setting: Option<&str> = None;\nmatch setting {\n    Some(value) => println!(\"{value}\"),\n}","choices":[],"answer":{"kind":"fix","value":"Add a `None` arm, such as `None => println!(\"not configured\")`."},"explanation":"A `match` on `Option` must cover both variants. Rust uses exhaustive matching to ensure the absent case is handled deliberately.","references":[{"title":"Option and Result handling","path":"../../02-standard-library/error_handling_basics/README.md"}]}
