{"schema_version":1,"id":"quiz-borrow-option-as-deref","type":"fix_error","topic":"ownership","difficulty":"intermediate","concepts":["borrowing","option","as-deref"],"question":"How can this function return a borrowed string slice without moving the `String` out of the option?","code":"fn label(value: &Option<String>) -> Option<&str> {\n    value.map(|text| text.as_str())\n}","choices":[],"answer":{"kind":"fix","value":"Use `value.as_deref()` or `value.as_ref().map(String::as_str)` so the function maps over a borrow instead of trying to move from `&Option<String>`."},"explanation":"Calling `map` directly on `&Option<String>` tries to use the by-value `Option::map` method. `as_deref` converts the borrowed option into `Option<&str>` without moving the owned string.","references":[{"title":"Ownership","path":"../../01-core-fundamentals/ownership/README.md"},{"title":"Option and Result handling","path":"../../02-standard-library/error_handling_basics/README.md"}]}
