{"schema_version":1,"id":"code-review-panic-on-input","type":"code_review","topic":"result","difficulty":"beginner","concepts":["result","error-handling","api-design"],"question":"Review this parser for user input. What behaviour should the API expose instead of panicking?","code":"fn parse_age(input: &str) -> u8 {\n    input.parse().unwrap()\n}","choices":[],"answer":{"kind":"review","value":"Invalid input is an expected outcome, so return `Result<u8, _>` or a domain error instead of calling `unwrap`. The caller can then report or recover from the parse failure."},"explanation":"A panic removes the caller’s ability to decide how invalid user input is handled. `Result` preserves that decision at the API boundary.","references":[{"title":"Option and Result handling","path":"../../../02-standard-library/error_handling_basics/README.md"}]}
