{"schema_version":1,"id":"quiz-option-unwrap-boundary","type":"design_choice","topic":"result","difficulty":"beginner","concepts":["option","error-handling"],"question":"A user-provided search may return no record. Which approach gives the caller the clearest way to handle that normal outcome?","choices":[{"id":"a","text":"Return Option<Record>"},{"id":"b","text":"Call unwrap before returning"},{"id":"c","text":"Return a fake default record"}],"answer":{"kind":"choice","value":"a"},"explanation":"Absence is part of the function’s ordinary result, so `Option<Record>` represents it directly. Panicking or inventing data hides a case the caller needs to decide about.","references":[{"title":"Option and Result handling","path":"../../02-standard-library/error_handling_basics/README.md"}]}
