{"schema_version":1,"id":"quiz-trait-implementation","type":"fix_error","topic":"traits","difficulty":"beginner","concepts":["traits","implementations"],"question":"What must be added so `announce(&task)` can call `describe`?","code":"trait Describable {\n    fn describe(&self) -> String;\n}\n\nstruct Task;\n\nfn announce(item: &impl Describable) {\n    println!(\"{}\", item.describe());\n}","choices":[],"answer":{"kind":"fix","value":"Add `impl Describable for Task` with a `describe` method, then create `Task` and pass a reference to it."},"explanation":"Defining a trait does not automatically make a type implement it. The explicit `impl` block supplies the behaviour required by the function’s bound.","references":[{"title":"Traits and polymorphism","path":"../../06-intermediate-rust/traits_and_polymorphism/README.md"}]}
