{"schema_version":1,"id":"quiz-tuple-destructure","type":"predict_output","topic":"data-types","difficulty":"beginner","concepts":["tuples","destructuring"],"question":"What does this program print?","code":"let point = (3, 5);\nlet (x, y) = point;\nprintln!(\"{}\", x + y);","choices":[],"answer":{"kind":"output","value":"8"},"explanation":"The tuple pattern assigns its first and second values to `x` and `y`, which are then added.","references":[{"title":"Data types","path":"../../01-core-fundamentals/data_types/README.md"}]}
