{"schema_version":1,"id":"quiz-cargo-test","type":"multiple_choice","topic":"tooling","difficulty":"beginner","concepts":["cargo","testing"],"question":"Which command compiles and runs the test functions marked with `#[test]`?","choices":[{"id":"a","text":"cargo test"},{"id":"b","text":"cargo fmt"},{"id":"c","text":"cargo doc"}],"answer":{"kind":"choice","value":"a"},"explanation":"`cargo test` builds the test targets and executes their test functions. Formatting and documentation commands do not run tests.","references":[{"title":"Testing","path":"../../03-tooling-and-quality/testing/README.md"}]}
