{"schema_version":1,"id":"quiz-mutability-binding","type":"multiple_choice","topic":"variables-mutability","difficulty":"beginner","concepts":["mutability","bindings"],"question":"Which binding can be reassigned after it is created?","choices":[{"id":"a","text":"let count = 0;"},{"id":"b","text":"let mut count = 0;"},{"id":"c","text":"const COUNT: i32 = 0;"}],"answer":{"kind":"choice","value":"b"},"explanation":"Bindings are immutable by default. The `mut` keyword makes this particular binding mutable; it does not make every use of the value mutable.","references":[{"title":"Variables and mutability","path":"../../01-core-fundamentals/variables_and_mutability/README.md"}]}
