{"schema_version":1,"id":"quiz-vector-move","type":"will_it_compile","topic":"ownership","difficulty":"beginner","concepts":["ownership","vectors","moves"],"question":"Will this compile?","code":"let numbers = vec![1, 2, 3];\nlet saved = numbers;\nprintln!(\"{numbers:?}\");","choices":[],"answer":{"kind":"compiles","value":"false"},"explanation":"A `Vec<T>` owns its allocation and does not implement `Copy`. Assigning it moves ownership to `saved`, leaving `numbers` unavailable.","references":[{"title":"Ownership","path":"../../01-core-fundamentals/ownership/README.md"}]}
