{"schema_version":1,"id":"quiz-where-clause","type":"multiple_choice","topic":"generics","difficulty":"intermediate","concepts":["generics","where-clauses"],"question":"Why might an author use a `where` clause on a generic function?","choices":[{"id":"a","text":"To place several trait bounds where a long signature stays readable"},{"id":"b","text":"To bypass trait bounds"},{"id":"c","text":"To make every generic type dynamically dispatched"}],"answer":{"kind":"choice","value":"a"},"explanation":"A `where` clause is alternate syntax for bounds. It is especially useful when bounds are numerous or include associated-type constraints.","references":[{"title":"Generics","path":"../../06-intermediate-rust/generics/README.md"}]}
