{"schema_version":1,"id":"quiz-option-if-let","type":"predict_output","topic":"result","difficulty":"beginner","concepts":["option","if-let"],"question":"What does this program print?","code":"let score = Some(8);\nif let Some(value) = score {\n    println!(\"{}\", value * 2);\n}","choices":[],"answer":{"kind":"output","value":"16"},"explanation":"`if let Some(value)` runs its body only when the option contains a value, binding the inner integer to `value`.","references":[{"title":"Option and Result handling","path":"../../02-standard-library/error_handling_basics/README.md"}]}
