{"schema_version":1,"id":"quiz-shadowing-change-type","type":"predict_output","topic":"variables-mutability","difficulty":"beginner","concepts":["shadowing","types"],"question":"What does this program print?","code":"let spaces = \"   \";\nlet spaces = spaces.len();\nprintln!(\"{spaces}\");","choices":[],"answer":{"kind":"output","value":"3"},"explanation":"The second `let` creates a new binding named `spaces`. It shadows the string binding and may have a different type, so the program prints the string length.","references":[{"title":"Variables and mutability","path":"../../01-core-fundamentals/variables_and_mutability/README.md"}]}
