{"schema_version":1,"id":"code-review-public-concrete-type","type":"code_review","topic":"traits","difficulty":"intermediate","concepts":["traits","api-design","abstraction"],"question":"Review this public helper. How could its parameter be broadened without allocating or forcing callers to construct a `Vec`?","code":"pub fn print_all(names: &Vec<String>) {\n    for name in names {\n        println!(\"{name}\");\n    }\n}","choices":[],"answer":{"kind":"review","value":"Accept a slice, `&[String]`, when the function only needs to iterate over existing names. That works with vectors and slices without exposing a needless concrete collection requirement."},"explanation":"Public signatures should ask for the capabilities they need. A slice expresses read-only sequential access more generally than `&Vec<String>`.","references":[{"title":"Traits and polymorphism","path":"../../../06-intermediate-rust/traits_and_polymorphism/README.md"}]}
