{"schema_version":1,"id":"quiz-derived-debug","type":"fix_error","topic":"traits","difficulty":"beginner","concepts":["derive","debug"],"question":"What attribute should be added above this struct so `println!(\"{item:?}\")` can format it for debugging?","code":"struct Item {\n    id: u32,\n}","choices":[],"answer":{"kind":"fix","value":"Add `#[derive(Debug)]` above `struct Item`."},"explanation":"The `:?` formatter needs `Debug`. For a simple struct, deriving that standard trait is the direct solution.","references":[{"title":"Traits and polymorphism","path":"../../06-intermediate-rust/traits_and_polymorphism/README.md"}]}
